Tech,Company,Country,NumberOfInstalations,OperationalSince,Product,MarketValue,TRL,AdditonalChemical1,SupplyChemical1kg/kgP-PO4),AdditonalChemical2,SupplyChemical2(kg/kgP-PO4),AdditonalChemical3,SupplyChemical3(kg/kgP-PO4),AdditonalChemical4,SupplyChemical4(kg/kgP-PO4),Energy(kg/kgP-PO4feed),OperationMode,CODReduction,SLSeparation,Dryer,EquipmentType,PinffluentConcMin(mg/L),PinffluentConcMax(mg/L),PremovalEfficiency,PeffluentConc(mg/L),NremovalEfficiency,NeffluentConc(mg/L),UnitSize(kgP-PO4/dayfeed),UnitEquipCapitalCost(USD),LaborCost(FTE),UnitOperatingCost(USD/kgP-PO4feed),Footprint(m2),Ref,,,,
Multiform,Multiform Harvest,USA,4,2012,Struvite,3,9,NaOH,6.06,MgCl2(32w/w%),12.12,nan,nan,nan,nan,,Continuous,No,No,Yes,FBR,55,-,88,12,,,38.5,1045000,0.25,15.419,93,AMPC 2018. Final Report. Struvite or Traditioal Chemical Phosphorus Precipitation-What option Rocks?,,,,
NuReSys,Nutrient Recovery Systems,Belgium,10,2008,Struvite,4,9,NaOH,0,MgCl2(32w/w%),12.12,nan,nan,nan,nan,,Continuous,Yes,No,Yes,CSTR,60,650,,30,,,204,1380655,-,6.22,-,AMPC 2018. Final Report. Struvite or Traditioal Chemical Phosphorus Precipitation-What option Rocks?,,,,
Pearl 500,Ostara,Canada,14,2009,Struvite,4,9,NaOH,1.27,MgCl2(32w/w%),10.9,nan,nan,nan,nan,,Continuous,No,No,Yes,FBR,-,-,,30,,,65,2300000,-,7.54,-," Ohio Water Environment Association, ""A Green Alternative for Dissolved Nutrient Recovery in Wastewater Side Streams."" http://www.ohiowea.org/docs/01_EcoAlternative_Nutrient_Recovery. pdf. [Online; accessed 20-March-2019]. ","Australian Meat Processor Corporation, ""Struvite or Traditional Chemical Phosphorus Precipitation What Option Rocks?.""https://www.ampc.com.au/uploads/cgblog/id408/2018-1026_-_Final_Report.pdf, 2018. [Online; accessed 20-March-2019].","American Society of Civil Engineers (ASCE), ""Chicago to Add Nutrient Recovery to Largest Plant."" https://www.asce.org/magazine/20131105-chicago-to-add-nutrient-recovery-to-largest-plant/, 2013. [Online; accessed21-March-2019].","Chicago Tribune, ""Clean water: Chicago takes a leap."" https://www.chicagotribune.com/news/opinion/editorials/ct-chicago-river-water-ostara-mwrd-stickney-phosphorous-edit-md-20160524-story.html, 2016. [Online; accessed 21-March-2019].","Ostara Nutrient Recovery Technologies Inc., ""Pearl fluidized bed reactor design,"" tech. rep., OstaraNutrient Recovery Technologies Inc."
Pearl 2K,Ostara,Canada,14,2009,Struvite,4,9,NaOH,1.27,MgCl2(32w/w%),10.9,nan,nan,nan,nan,,Continuous,No,No,Yes,FBR,-,-,,30,,,250,3100000,-,7.54,-," Ohio Water Environment Association, ""A Green Alternative for Dissolved Nutrient Recovery in Wastewater Side Streams."" http://www.ohiowea.org/docs/01_EcoAlternative_Nutrient_Recovery. pdf. [Online; accessed 20-March-2019]. ","Australian Meat Processor Corporation, ""Struvite or Traditional Chemical Phosphorus Precipitation What Option Rocks?.""https://www.ampc.com.au/uploads/cgblog/id408/2018-1026_-_Final_Report.pdf, 2018. [Online; accessed 20-March-2019].","American Society of Civil Engineers (ASCE), ""Chicago to Add Nutrient Recovery to Largest Plant."" https://www.asce.org/magazine/20131105-chicago-to-add-nutrient-recovery-to-largest-plant/, 2013. [Online; accessed21-March-2019].","Chicago Tribune, ""Clean water: Chicago takes a leap."" https://www.chicagotribune.com/news/opinion/editorials/ct-chicago-river-water-ostara-mwrd-stickney-phosphorous-edit-md-20160524-story.html, 2016. [Online; accessed 21-March-2019].","Ostara Nutrient Recovery Technologies Inc., ""Pearl fluidized bed reactor design,"" tech. rep., OstaraNutrient Recovery Technologies Inc."
Pearl 10K,Ostara,Canada,14,2009,Struvite,4,9,NaOH,1.27,MgCl2(32w/w%),10.9,nan,nan,nan,nan,,Continuous,No,No,Yes,FBR,-,-,,30,,,1250,10000000,-,7.54,-," Ohio Water Environment Association, ""A Green Alternative for Dissolved Nutrient Recovery in Wastewater Side Streams."" http://www.ohiowea.org/docs/01_EcoAlternative_Nutrient_Recovery. pdf. [Online; accessed 20-March-2019]. ","Australian Meat Processor Corporation, ""Struvite or Traditional Chemical Phosphorus Precipitation What Option Rocks?.""https://www.ampc.com.au/uploads/cgblog/id408/2018-1026_-_Final_Report.pdf, 2018. [Online; accessed 20-March-2019].","American Society of Civil Engineers (ASCE), ""Chicago to Add Nutrient Recovery to Largest Plant."" https://www.asce.org/magazine/20131105-chicago-to-add-nutrient-recovery-to-largest-plant/, 2013. [Online; accessed21-March-2019].","Chicago Tribune, ""Clean water: Chicago takes a leap."" https://www.chicagotribune.com/news/opinion/editorials/ct-chicago-river-water-ostara-mwrd-stickney-phosphorous-edit-md-20160524-story.html, 2016. [Online; accessed 21-March-2019].","Ostara Nutrient Recovery Technologies Inc., ""Pearl fluidized bed reactor design,"" tech. rep., OstaraNutrient Recovery Technologies Inc."
Crystalactor,Royal HaskoningDHV,Netherlands,70,1980,CaP/MAP,2,9,NaOH,0.9,CaOH2,6.8,H2SO4,1.3,Sand,0.2,,Continuous,No,No,Yes,FBR,25,-,,10,,,137.7,240052.44+54888.52*(n_units-1),-,2.12,-,R.J.M. van Lier and C.J.N. Buisman and A. Giesen Crystalactor technology and its applications in the mining and metallurgical industry,"Egle et al 2016. Phosphorus recovery from municial wastewater: An integrated comparative technological, enviromental and economic assessment of P recovery technologies",,,
P-Roc,Karlsruhe Institute of Technology,Germany,Pilot,2015,CaP,3,6,Calcium silicate hydrate,12,nan,nan,nan,nan,nan,nan,,Continuous,No,No,Yes,CSTR,30,-,60,-,,,-,Our estimation,-,"if kgPO4feed/day < 135, 115.5; if kgPO4feed/day >662, 67.9; else -0.09*kgPO4feed/day+127.19",-,"Egle et al 2016. Phosphorus recovery from municial wastewater: An integrated comparative technological, enviromental and economic assessment of P recovery technologies","Ehbrecht et al, 2015. P-RoC-technology - field of application. 2nd European Sustainable Phosphorus Conference (ESPC2)",,,
MAPHEX,Penn University and USDA,,Pilot,2018,Cake,1,7,Fe2(SO4)3,17.5,nan,nan,nan,nan,nan,nan,,Continuous,No,Yes,No,Chemical+Filtration,nan,nan,90,27.8,90,385.8,18.54,291000,-,110.8,36.48,"Church, C. D., Hristov, A. N., Bryant, R. B., Fishel, S. K., and Kleinman, P. J. A.(2016). A novel treatment system to remove phosphorus from liquid manure. Appl. Eng. Agric., 32(1), 103-112. https://doi.org/10.13031/aea.32.10999",,,,
